Category,Product Name,Botanical Name / Source,Active Ingredient,Primary Application
Standardized Herbal Extracts,Acai Berry Extract,Euterpe oleracea,Polyphenols 10%–20%,"Antioxidant Support, Skin Health, Anti-Aging"
Standardized Herbal Extracts,Acerola Cherry Extract,Malpighia glabra,Natural Vitamin C 17%–25%,"Immunity Boost, Skin Health, Antioxidant Support"
Standardized Herbal Extracts,Aloe Vera Extract,Aloe barbadensis,Polyphenols / 200:1,Cosmetics
Standardized Herbal Extracts,Amaltas Extract,Cassia fistula,Anthraquinones 5%,"Natural Laxative, Detox Support, Skin Health"
Standardized Herbal Extracts,Amla Extract,Emblica officinalis,Tannins 20%–50%,"Skin & Hair Care, Anti-Aging"
Standardized Herbal Extracts,Anar Chilka Extract,Punica granatum (Peel),Ellagic Acid 20%–40%,"Antioxidant, Gut Health, Oral & Skin Care Support"
Standardized Herbal Extracts,Apamarga Extract,Achyranthes aspera,Saponins 10%,"Diuretic Support, Digestive Health, Anti-inflammatory"
Standardized Herbal Extracts,Apple Extract,Malus domestica,Polyphenols 40%,"Antioxidant, Skin Health, Cardiovascular Support"
Standardized Herbal Extracts,Arjuna Extract,Terminalia arjuna,"Arjunolic Acid, 0.1% Tannins",Cardiac Health
Standardized Herbal Extracts,Artichoke Extract,Cynara scolymus,Cynarin 2.5%,"Liver Health, Digestive Support, Cholesterol Management"
Standardized Herbal Extracts,Ashoka Chaal Extract,Saraca asoca,Tannins 10%–20%,"Female Reproductive Health, Uterine Tonic, Menstrual Support"
Standardized Herbal Extracts,Astragalus Extract,Astragalus membranaceus,Polysaccharides 50%,"Immune Support, Anti-aging, Adaptogen"
Standardized Herbal Extracts,Ashwagandha Extract,Withania somnifera,Withanolides 1.5%–10%,"Stress Relief, Adaptogen"
Standardized Herbal Extracts,Bacopa Extract,Bacopa monnieri,Bacosides 20%–50% USP,Memory Support
Standardized Herbal Extracts,Baheda Extract,Terminalia bellirica,Tannins 30%,Digestive Harmony
Standardized Herbal Extracts,Banaba Extract,Lagerstroemia speciosa,Corosolic Acid 1%–2%,"Blood Sugar, Weight"
Standardized Herbal Extracts,Beet Root Extract,Beta vulgaris,"Betanin, Nitrates","Sports Nutrition, Heart Health"
Standardized Herbal Extracts,Berberine Extract,Berberis aristata,Berberine 97% (HPLC),"Blood Sugar Support, Gut Health, Anti-microbial"
Standardized Herbal Extracts,Beta Carotene Extract,Daucus carota,Beta Carotene 30%,"Skin Health, Antioxidant"
Standardized Herbal Extracts,Bhringraj Extract,Eclipta alba,Bitters 6%,Liver Support
Standardized Herbal Extracts,Bhumi Amla Extract,Phyllanthus niruri,Bitters 5%,"Liver, Kidney, Diabetes"
Standardized Herbal Extracts,Bidarikand Extract,Pueraria tuberosa,Saponins 20%,"Male Vitality, Rejuvenation, Muscle Strength Support"
Standardized Herbal Extracts,Bilberry Extract,Vaccinium myrtillus,Anthocyanins 25% (UV),"Eye Health, Antioxidant, Vision Support"
Standardized Herbal Extracts,Bitter Melon Extract,Momordica charantia,"Charantin 0.5%, Bitters 10% & 20%",Blood Sugar
Standardized Herbal Extracts,Black Cohosh Extract,Cimicifuga racemosa,Triterpene Glycosides 2.5%,"Menopause Support, Hormonal Balance, Women's Health"
Standardized Herbal Extracts,Black Currant Extract,Ribes nigrum,Anthocyanins 25% (UV),"Vision Support, Immunity Boost, Antioxidant"
Standardized Herbal Extracts,Black Pepper Extract,Piper nigrum,Piperine 95%,"Bioavailability, Respiratory"
Standardized Herbal Extracts,Blueberry Extract,Vaccinium corymbosum,Anthocyanins 25% (UV),"Eye Health, Cognitive Support, Antioxidant"
Standardized Herbal Extracts,Boswellia Extract,Boswellia serrata,"Boswellic Acid 65-80%, AKBA 10-90%","Joints, Skin, Anti-inflammatory"
Standardized Herbal Extracts,Burdock Seed Extract,Arctium lappa (Seeds),Inulin 10%,"Detoxification, Liver Support, Skin & Blood Purifier"
Standardized Herbal Extracts,Butterbur Nut Extract,Petasites hybridus,Petasin & Isopetasin 15%,"Migraine Support, Allergy Relief, Anti-inflammatory"
Standardized Herbal Extracts,Capsicum Extract,Capsicum annum,Capsaicin 80%–90%,"Pain, Inflammation"
Standardized Herbal Extracts,Caralluma Extract,Caralluma fimbriata,Glycosides 20%,Weight Management
Standardized Herbal Extracts,Cat's Claw Extract,Uncaria tomentosa,Alkaloids 3%–5%,"Immune Modulation, Joint Support, Anti-inflammatory"
Standardized Herbal Extracts,Chaste Berry Extract,Vitex agnus-castus,Agnusides 0.5%–1%,"PMS Relief, Hormonal Balance, Female Reproductive Support"
Standardized Herbal Extracts,Chireta Extract,Swertia chirata,Bitters 10%–20%,"Liver Support, Blood Purifier, Antimicrobial Activity"
Standardized Herbal Extracts,Chitrakmool Extract,Plumbago zeylanica,Plumbagin 2%–5%,"Digestive Stimulant, Metabolism Support, Anti-inflammatory"
Standardized Herbal Extracts,Chlorela Powder,Chlorella vulgaris,Natural Chlorophyll 60%,"Detoxification, Alkalizing, Immune Support"
Standardized Herbal Extracts,Cinnamon Extract,Cinnamomum cassia,Polyphenols 10%–20%,"Antioxidant, Anti-diabetic"
Standardized Herbal Extracts,Citrus Aurantium Extract,Citrus aurantium,Synephrine 6%–10%,"Weight Management, Thermogenic, Appetite Control"
Standardized Herbal Extracts,Coleus Extract,Coleus forskohlii,Forskolin 10%–20%,"Weight, Sports Health"
Standardized Herbal Extracts,Cranberry Extract,Vaccinium macrocarpon,Proanthocyanidins 25%,"Urinary Tract Health, Antioxidant, Women's Wellness"
Standardized Herbal Extracts,Damiana Extract,Turnera diffusa,Flavonoids 5%,"Libido Enhancement, Mood Support, Nervine Tonic"
Standardized Herbal Extracts,Dandelion Leaf Extract,Taraxacum officinale,Taraxacin 4%,"Liver Support, Diuretic, Detoxification"
Standardized Herbal Extracts,Devil's Claw Extract,Harpagophytum procumbens,Harpagosides 1.5%–5%,"Joint Support, Anti-inflammatory, Pain Relief"
Standardized Herbal Extracts,Fenugreek Extract,Trigonella foenumgraecum,Saponins 40%–50%,Glucose & Heart Health
Standardized Herbal Extracts,Feverfew Extract,Tanacetum parthenium,Parthenolide 0.5%–1%,"Migraine Support, Anti-inflammatory, Headache Relief"
Standardized Herbal Extracts,Ganoderma Extract,Ganoderma lucidum,Polysaccharides 30%–50%,"Immunity Boost, Anti-stress, Liver & Heart Support"
Standardized Herbal Extracts,Garcinia Cambogia Extract,Garcinia cambogia,HCA 50%–60%,"Appetite, Weight"
Standardized Herbal Extracts,Garlic Extract,Allium sativum,Allicin 0.5%–1%,"Cardiovascular Support, Immunity Boost, Antimicrobial"
Standardized Herbal Extracts,Ginger Extract,Zingiber officinale,Gingerol 5%,"Digestion, Inflammation"
Standardized Herbal Extracts,Gingko Biloba Extract,Ginkgo biloba,"Flavone Glycosides 24%, Terpene Lactones 6%","Cognitive Support, Memory Enhancement, Circulatory Health"
Standardized Herbal Extracts,Gokhru Extract,Tribulus terrestris,Saponins 55%,Sexual Wellness
Standardized Herbal Extracts,Gotu Kola Extract,Centella asiatica,Asiaticosides 10–90%,"Skin, Hair, Brain Health"
Standardized Herbal Extracts,Grape Seed Extract (Draksha),Vitis vinifera,Proanthocyanidins 95% (OPC),"Antioxidant, Cardiovascular Support, Skin Health"
Standardized Herbal Extracts,Green Coffee Extract,Coffea robusta,Chlorogenic Acid 45%–50%,"Antioxidant, Weight"
Standardized Herbal Extracts,Green Tea Extract,Camellia sinensis,"Polyphenols 98%, EGCG 40%","Antioxidant, Metabolism"
Standardized Herbal Extracts,Guduchi Extract,Tinospora cordifolia,Bitters 10%–20%,"Immunity Booster, Antipyretic, Adaptogen, Detox Support"
Standardized Herbal Extracts,Guggul Extract,Commiphora mukul,Guggulsterones 2.5% E & Z by HPLC,"Cholesterol, Fat Loss"
Standardized Herbal Extracts,Gymnema Extract,Gymnema sylvestre,Gymnemic Acid 25%–75%,Sugar Blocker
Standardized Herbal Extracts,Hadjod Extract,Cissus quadrangularis,Keto Sterones,Bone Repair
Standardized Herbal Extracts,Harad Extract,Terminalia chebula,Tannins 50%,Digestive Health
Standardized Herbal Extracts,Holy Basil Extract,Ocimum sanctum,Ursolic Acid 2.5%,"Cough, Cold, Antioxidant"
Standardized Herbal Extracts,Horny Goat Weed Extract,Epimedium grandiflorum,Icariin 10%–20%,"Male Vitality, Libido Enhancement, Bone & Joint Support"
Standardized Herbal Extracts,Horse Chestnut Extract,Aesculus hippocastanum,Aescin upto 90%,"Varicose Veins, Circulation Support, Anti-inflammatory"
Standardized Herbal Extracts,Jamun Extract,Syzygium cumini (syn. Eugenia jambolana),"Jamboline 5%, Tannins 10%","Blood Sugar Support, Antioxidant, Digestive Health"
Standardized Herbal Extracts,Jatamansi Extract,Nardostachys jatamansi,Jatamansone 0.2%–0.5%,"Stress Relief, Cognitive Support, Nervine Tonic, Sleep Aid"
Standardized Herbal Extracts,Jivanti Extract,Leptadenia reticulata,Alkaloids 0.5%–1%,"Rejuvenation, Lactation Support, Immunity, Eye Health"
Standardized Herbal Extracts,Kachnar Extract,Bauhinia variegata,Tannins 10%–15%,"Thyroid Support, Anti-inflammatory, Lymphatic Detox"
Standardized Herbal Extracts,Kali Musli Extract,Curculigo orchioides,Saponins 10%–20%,"Male Vitality, Aphrodisiac, Strength & Rejuvenation"
Standardized Herbal Extracts,Kalmegh Extract,Andrographis paniculata,Andrographolides 10%–95%,"Liver Tonic, Blood Cleanser"
Standardized Herbal Extracts,Kalonji Extract,Nigella sativa,Thymoquinone 5%,"Antioxidant, Immune Support, Metabolism & Respiratory Health"
Standardized Herbal Extracts,Kasni Extract,Cichorium intybus,Inulin 10%,"Liver Support, Digestive Health, Blood Purification"
Standardized Herbal Extracts,Kasondi Extract,Cassia occidentalis,Anthraquinones 5%,"Liver Support, Skin Disorders, Blood Purifier, Laxative"
Standardized Herbal Extracts,Khadir Extract,Acacia catechu,Catechins 10%–20%,"Oral Health, Skin Disorders, Blood Purification, Anti-inflammatory"
Standardized Herbal Extracts,Kulthi Dal Extract,Macrotyloma uniflorum,Flavonoids 5%–10%,"Kidney Stone Management, Diuretic Support, Detoxification"
Standardized Herbal Extracts,Kutki Extract,Picrorhiza kurroa,Kutkin 4%–6%,"Liver Support, Hepatoprotective, Digestive & Immune Health"
Standardized Herbal Extracts,Liquorice Extract,Glycyrrhiza glabra,Glycyrrhizic Acid 10%–20%,"Digestion, Respiratory"
Standardized Herbal Extracts,Lodhra Extract,Symplocos racemosa,Tannins 10%–20%,"Women's Health, Uterine Tonic, Anti-inflammatory, Skin Health"
Standardized Herbal Extracts,Macca Root Extract,Lepidium meyenii,Macamides & Macaenes 0.5%–1%,"Energy & Stamina, Hormonal Balance, Fertility & Libido Support"
Standardized Herbal Extracts,Makoi Extract,Solanum nigrum,Alkaloids 0.3%–0.5%,"Liver Support, Anti-inflammatory, Gastric Protection, Detox"
Standardized Herbal Extracts,Mango (Amra) Extract,Mangifera indica,Mangiferin 10%–20%,"Antioxidant, Skin Health, Immune Support, Digestive Wellness"
Standardized Herbal Extracts,Manjistha Extract,Rubia cordifolia,Rubiadin 1%–2%,"Blood Purifier, Skin Health, Lymphatic Detox, Anti-inflammatory"
Standardized Herbal Extracts,Marigold Extract,Tagetes erecta,"Lutein 5–20%, Zeaxanthin up to 4%",Eye Health
Standardized Herbal Extracts,Milk Thistle Extract,Silybum marianum,Silymarin 80%,"Liver Protection, Detox Support, Antioxidant, Hepatoprotective"
Standardized Herbal Extracts,Moringa Extract,Moringa oleifera,Total Saponins 10% / Polyphenols 20%,"Nutritional Support, Antioxidant, Anti-inflammatory, Immune Boost"
Standardized Herbal Extracts,Mucuna Extract,Mucuna pruriens,L-DOPA up to 50%,"Libido, Mood Support"
Standardized Herbal Extracts,Nagarmotha Extract,Cyperus rotundus,Volatile Oils 1%–2%,"Digestive Health, Weight Management, Anti-inflammatory, Skin Support"
Standardized Herbal Extracts,Nagkesar Extract,Mesua ferrea,Flavonoids 5%–10%,"Bleeding Disorders, Skin Health, Anti-inflammatory, Uterine Tonic"
Standardized Herbal Extracts,Neem Extract,Azadirachta indica,Bitters up to 8%,"Anti-bacterial, Skin"
Standardized Herbal Extracts,Noni Extract / Noni Fruit Powder,Morinda citrifolia,Polysaccharides 10%,"Immunity Boost, Antioxidant, Digestive Support, Cellular Health"
Standardized Herbal Extracts,Nirgundi Extract,Vitex negundo,Flavonoids 5%–10%,"Joint Support, Pain Relief, Anti-inflammatory, Respiratory Health"
Standardized Herbal Extracts,Olive Leaf Extract,Olea europaea,Oleuropein 20%,"Heart Health, Antioxidant, Immune Support, Antimicrobial"
Standardized Herbal Extracts,Pashanbheda Extract,Bergenia ligulata,Bergenin 2%–4%,"Kidney Stone Management, Diuretic Support, Urinary Tract Health"
Standardized Herbal Extracts,Pippali Extract,Piper longum,Piperine 5%–10%,"Respiratory Health, Digestive Support, Bioavailability Enhancer, Immunity"
Standardized Herbal Extracts,Punarnava Extract,Boerhavia diffusa,Boeravinone 2%–4%,"Diuretic Support, Kidney & Liver Health, Anti-inflammatory, Edema Management"
Standardized Herbal Extracts,Pit Papara Extract,Fumaria parviflora,Alkaloids 0.5%–1%,"Liver Support, Skin Disorders, Digestive Cleanse, Blood Purifier"
Standardized Herbal Extracts,Rhodiola rosea Extract,Rhodiola rosea,"Rosavins 3%, Salidroside 1%","Stress Reduction, Mental Performance, Energy, Adaptogen"
Standardized Herbal Extracts,Rhubarb Extract,Rheum emodi / Rheum officinale,Anthraquinones 5%–10%,"Natural Laxative, Digestive Cleanse, Liver Support, Colon Health"
Standardized Herbal Extracts,Rohitaka Extract,Tecomella undulata,Flavonoids 5%–10%,"Liver Health, Skin Disorders, Anti-inflammatory, Hepatoprotective"
Standardized Herbal Extracts,Safed Musli Extract,Chlorophytum borivilianum,Saponins 20%–40%,"Male Vitality, Strength & Stamina, Aphrodisiac, Rejuvenation"
Standardized Herbal Extracts,Salacia Extract,Salacia oblonga/reticulata,Saponins 20%,Anti-diabetic support
Standardized Herbal Extracts,Sarsaparilla Extract,Smilax ornata,Extract 4:1,"Skin health, psoriasis"
Standardized Herbal Extracts,Senna Leaf Extract,Cassia angustifolia,Sennosides up to 60%,Laxative
Standardized Herbal Extracts,Sesame Seed Extract,Sesamum indicum,Sesamin Complex 70%,Cardiovascular support
Standardized Herbal Extracts,Shatavari Extract,Asparagus racemosus,Saponins 50%,"Female wellness, adaptogen"
Standardized Herbal Extracts,Shankhpushpi Extract,Convolvulus pluricaulis,Alkaloids & Flavonoids 2%–5%,"Brain Tonic, Memory Support, Stress Relief, Cognitive Wellness"
Standardized Herbal Extracts,Saunf Extract,Foeniculum vulgare,Volatile Oils 1%–2% (Anethole),"Digestive Support, Carminative, Bloating Relief, Hormonal Balance"
Standardized Herbal Extracts,Shatavari Extract,Asparagus racemosus,Saponins 20%–30%,"Female Reproductive Health, Hormonal Balance, Lactation Support, Adaptogen"
Standardized Herbal Extracts,Shilajit Extract,Asphaltum,Fulvic Acid 2–50%,Vitality and endurance
Standardized Herbal Extracts,Spinach Extract,Spinacia oleracea,"Nitrate 9%, Potassium 13%","Bone, skin, hair support"
Standardized Herbal Extracts,Tagar Extract,Valeriana wallichii,Valepotriates 0.5%–1%,"Sleep Support, Nervine Tonic, Stress Relief, Mild Sedative"
Standardized Herbal Extracts,Tongkat Ali Extract,Eurycoma longifolia,Eurycomanone 1%–2%,"Testosterone Support, Male Vitality, Libido Enhancement, Energy & Stamina"
Standardized Herbal Extracts,Triphala Extract,"Emblica officinalis, Terminalia bellirica, T. chebula",Tannins up to 45%,"Digestive Cleanse, Antioxidant, Colon Health, Detoxification"
Standardized Herbal Extracts,Trikatu Extract,"Piper nigrum, Piper longum, Zingiber officinale","Piperine 5%, Gingerols 2%","Digestive Support, Bioavailability Enhancer, Metabolism Booster, Respiratory Health"
Standardized Herbal Extracts,Tulsi (Holy Basil) Extract,Ocimum sanctum / Ocimum tenuiflorum,"Ursolic Acid 2%–5%, Eugenol","Adaptogen, Respiratory Health, Antioxidant, Immunity Support"
Standardized Herbal Extracts,Turmeric Extract,Curcuma longa,Curcuminoids 95%,"Anti-inflammatory, antioxidant"
Standardized Herbal Extracts,Valerian Extract,Valeriana officinalis,Valerenic Acids 0.5%–1%,"Sleep Support, Anxiety Relief, Nervine Tonic, Mild Sedative"
Standardized Herbal Extracts,Varuna Extract,Crataeva religiosa,Saponins 10%,Urinary health support
Standardized Herbal Extracts,White Kidney Bean Extract,Phaseolus vulgaris,Phaseolamin 1%–2%,"Starch Blocker, Weight Management, Carbohydrate Metabolism Support"
Standardized Herbal Extracts,Yohimbine HCL Extract,Pausinystalia yohimbe,2%–98%,"Male Vitality, Libido Enhancement, Fat Burning, Energy Support"
Essential Oils,Clove Leaf Oil,Syzygium aromaticum,Eugenol (80–85%),"Oral Care, Antiseptic, Flavoring, Pain Relief"
Essential Oils,Cumin Seed Oil,Cuminum cyminum,Cuminaldehyde (30–45%),"Digestive Aid, Flavoring, Antioxidant, Antimicrobial"
Essential Oils,Eucalyptus Oil,Eucalyptus globulus,Eucalyptol (Cineole) 70–85%,"Respiratory Support, Antiseptic"
Essential Oils,Frankincense Oil,Boswellia serrata,α-Thujene up to 70%,"Anti-inflammatory, Skincare, Aromatherapy, Stress Relief"
Essential Oils,Garlic Oil,Allium sativum,"Allicin (varies, unstable), Diallyl disulfide (~50–60%) & Diallyl trisulfide (~10–15%)","Antimicrobial, Cardiovascular Support, Immune Booster, Flavoring"
Essential Oils,Ginger Oil,Zingiber officinale,Zingiberene (~30–35%),"Digestive Aid, Anti-inflammatory, Muscle Relief, Aromatherapy"
Essential Oils,Lemon Grass Oil,Cymbopogon citratus,Citral (neral + geranial) ~70–80%,"Antimicrobial, Aromatherapy, Insect Repellent, Flavoring, Perfumery"
Essential Oils,Nutmeg Oil,Myristica fragrans,"Myristicin ~10–15%, Safrole ~5–10%","Digestive Aid, Aromatherapy, Flavoring, Antimicrobial"
Essential Oils,Turmeric Oil,Curcuma longa,"Turmerone (~40–50%), Ar-turmerone (~10–15%)","Anti-inflammatory, Antioxidant, Skin Care, Aromatherapy"
Essential Oils,White Pepper Oil,Piper nigrum,"Limonene (~30–45%), Sabinene (~20–30%)","Flavoring, Digestive Aid, Anti-inflammatory, Aromatherapy"
Essential Oils,Black Pepper Oil,Piper nigrum,β-Caryophyllene (~25–35%),"Digestive Aid, Anti-inflammatory, Pain Relief, Flavoring, Aromatherapy"
Essential Oils,Lavender Oil,Lavandula angustifolia,Linalool (~25–45%),"Relaxation, Aromatherapy, Skincare, Antimicrobial"
Essential Oils,Peppermint Oil,Mentha piperita,Menthol (~30–55%),"Digestive Aid, Cooling Sensation, Aromatherapy, Pain Relief"
Essential Oils,Tea Tree Oil,Melaleuca alternifolia,Terpinen-4-ol (~30–40%),"Antimicrobial, Antiseptic, Skincare, Acne Treatment"
Essential Oils,Moringa oil,Moringa oleifera,"Oleic Acid (~70–75%), Palmitic Acid (~6–8%)","Skin Moisturizer, Anti-inflammatory, Hair Care, Antioxidant"
Essential Oils,Vetiver Oil,Vetiveria zizanoides,"Khusimol (~15–20%), Vetiselinenol (~10–15%)","Aromatherapy, Perfumes, Stress Relief, Anti-inflammatory"
Essential Oils,Neroli Oil,Citrus aurantium (Bitter Orange),"Linalool (~30–40%), Limonene (~10–20%)","Aromatherapy, Relaxation, Skincare, Perfumes"
Essential Oils,Bergamot Oil,Citrus bergamia,"Limonene (~30–45%), Linalyl acetate (~15–25%)","Aromatherapy, Mood Enhancer, Skincare, Flavoring"
Essential Oils,Patchouli Oil,Pogostemon cablin,Patchoulol (Patchouli alcohol) (~30–40%),"Aromatherapy, Perfumery, Anti-inflammatory, Skin Care"
Essential Oils,Rose oil,Rosa damascene,Citronellol (~20–30%),"Aromatherapy, Skincare, Mood Enhancer, Perfumery"
Oleoresins,Black Pepper Oleoresin,Piper nigrum,Piperine (~70–80%),"Flavoring, Bioavailability Enhancer, Antioxidant"
Oleoresins,Capsicum Oleoresin,Capsicum annuum,Capsaicinoids (~60–90%),"Spice, Pharmaceutical, Topical Analgesic"
Oleoresins,Cinnamon Oleoresin,Cinnamomum verum / Cinnamomum cassia,Cinnamaldehyde (~50–65%),"Flavoring, Antimicrobial, Food Preservation, Pharmaceutical"
Oleoresins,Coffee Oleoresin,Coffea arabica,Caffeine (~0.5–2%),"Flavoring, Fragrance, Cosmetics, Nutraceuticals"
Oleoresins,Coriander Oleoresin,Coriandrum sativum,"Linalool (~60–75%), α-Pinene (~5–10%)","Flavoring, Digestive Aid, Fragrance, Antimicrobial"
Oleoresins,Clove Oleoresin,Syzygium aromaticum,"Eugenol (~65–75%), β-Caryophyllene (~15–20%)","Flavoring, Antimicrobial, Oral Care, Pharmaceutical"
Oleoresins,Cumin Oleoresin,Cuminum cyminum,Cuminaldehyde (~25–35%),"Flavoring, Digestive Aid, Aromatherapy, Antioxidant"
Oleoresins,Dill Seed Oleoresin,Anethum graveolens,"Carvone (~40–60%), Limonene (~30–40%)","Flavoring, Digestive Support, Antispasmodic, Aromatherapy"
Oleoresins,Fennel Oleoresin,Foeniculum vulgare,"Anethole (~60–80%), Fenchone (~5–10%)","Flavoring, Digestive Aid, Carminative, Aromatherapy"
Oleoresins,Fenugreek Oleoresin,Trigonella foenumgraecum,Sotolon (~0.5–1.5%),"Flavoring, Lactation Support, Nutraceuticals, Ayurvedic Formulations"
Oleoresins,Garlic Oleoresin,Allium sativum,"Diallyl disulfide (~50–60%), Diallyl trisulfide (~15–25%)","Flavoring, Antimicrobial, Food Processing, Nutraceuticals"
Oleoresins,Ginger Oleoresin,Zingiber officinale,"Gingerols (~15–25%), Shogaols (~5–10%)","Flavoring, Digestive Aid, Pharmaceutical"
Oleoresins,Hing Oleoresin,Ferula asafoetida,Ferulic acid (~10–20%),"Digestive Aid, Antispasmodic, Flavoring, Ayurvedic Medicine"
Oleoresins,Mace Oleoresin,Myristica fragrans,"Myristicin (~4–10%), Elemicin (~5–8%)","Flavoring, Perfumery, Digestive Aid, Pharmaceutical Use"
Oleoresins,Nutmeg Oleoresin,Myristica fragrans,"Myristicin (~5–15%), Elemicin (~5–10%)","Flavoring, Aromatherapy, Digestive Aid, Pharmaceutical Formulations"
Oleoresins,Onion Oleoresin,Allium cepa,Dipropyl disulfide (~15–25%),"Flavoring, Antimicrobial, Food Processing, Nutraceuticals"
Oleoresins,Paprika Oleoresin,Capsicum annuum,"Capsaicin (~3–6%), Capsanthin (~50–60%)","Natural Coloring, Flavoring, Antioxidant, Food Industry"
Oleoresins,Turmeric Oleoresin,Curcuma longa,"Curcuminoids (~10–20%), Turmerones (~30–40%)","Natural Coloring, Anti-inflammatory, Food & Beverage"
Oleoresins,White Pepper Oleoresin,Piper nigrum,Piperine (~70–80%),"Flavoring, Digestive Aid, Food Preservation, Pharmaceutical"
Fruit Juice Powders,Amla Juice Powder,Emblica officinalis,"Tannins, Vitamin C","Rejuvenation, Skin & Hair Care"
Fruit Juice Powders,Apple Juice Powder,Malus domestica,"Natural Sugars, Polyphenols","Antioxidant, Energy Support, Flavoring"
Fruit Juice Powders,Banana Pulp/Powder,Musa paradisiaca,"Potassium, Natural Sugars","Energy, Digestion, Smoothie Additive"
Fruit Juice Powders,Beet Root Juice Powder,Beta vulgaris,"Betanin, Nitrates","Cardiovascular Health, Energy, Coloring"
Fruit Juice Powders,Coconut Water Powder,Cocos nucifera,"Electrolytes, Potassium","Hydration, Sports Nutrition"
Fruit Juice Powders,Custard Apple Powder,Annona reticulata (est.),"Natural Sugars, Vitamins","Energy, Nutraceutical Formulations"
Fruit Juice Powders,Date Fruit Powder,Phoenix dactylifera,"Glucose, Fiber, Polyphenols","Energy Support, Digestive Health"
Fruit Juice Powders,Guava Powder,Psidium guajava,"Vitamin C, Fiber","Immunity, Gut Health"
Fruit Juice Powders,Jamun Powder,Syzygium cumini,"Anthocyanins, Jamboline","Blood Sugar Management, Antioxidant"
Fruit Juice Powders,Kiwi Powder,Actinidia deliciosa,"Actinidin, Vitamin C","Skin Care, Immunity Support"
Fruit Juice Powders,Lemon Juice/Powder,Citrus limon,"Citric Acid, Ascorbic Acid","Digestive Support, Immunity, Detox"
Fruit Juice Powders,Litchi Powder,Litchi chinensis,"Vitamin C, Oligonol","Anti-aging, Energy, Flavoring"
Fruit Juice Powders,Mango Juice/Powder,Mangifera indica,"Carotenoids, Vitamin C","Immune Health, Skin Rejuvenation, Flavoring"
Fruit Juice Powders,Orange Juice/Powder,Citrus sinensis,"Vitamin C, Flavonoids","Immunity Support, Antioxidant, Flavoring"
Fruit Juice Powders,Papaya Powder,Carica papaya,"Papain, Beta-Carotene",Digestive Enzyme Support
Fruit Juice Powders,Peach Powder,Prunus persica,Carotenoids,"Skin Health, Beverage Additive"
Fruit Juice Powders,Pineapple Juice/Powder,Ananas comosus,"Bromelain, Vitamin C","Digestive Aid, Anti-inflammatory, Flavoring"
Fruit Juice Powders,Pomegranate Juice/Powder,Punica granatum,"Ellagic Acid, Polyphenols","Antioxidant, Heart & Cardiovascular Support"
Fruit Juice Powders,Sapota (Chikoo) Powder,Manilkara zapota,"Polyphenols, Sugars","Energy, Flavoring, Smoothie Base"
Fruit Juice Powders,Strawberry Juice/Powder,Fragaria × ananassa,"Anthocyanins, Vit-C","Skin Health, Antioxidant, Natural Coloring"
Fruit Juice Powders,Tamarind Pulp Powder,Tamarindus indica,"Tartaric Acid, Polyphenols","Digestive Aid, Flavoring"
Fruit Juice Powders,Watermelon Juice/Powder,Citrullus lanatus,"Lycopene, Citrulline","Hydration, Antioxidant, Skin Health"
Phytochemicals,5-Hydroxytryptophan (5-HTP),Griffonia simplicifolia,5-HTP,"Mood Support, Sleep Aid"
Phytochemicals,Berberine HCL,Berberis aristata,Berberine,Blood Sugar & Lipid Regulation
Phytochemicals,Beta Aescin,Aesculus hippocastanum,Aescin,"Venous Support, Anti-inflammatory"
Phytochemicals,Colchicine,Gloriosa superba,Colchicine,"Anti-Gout, Anti-Inflammatory"
Phytochemicals,Curcumin,Curcuma longa,Curcuminoids,"Antioxidant, Anti-inflammatory"
Phytochemicals,Forskolin,Coleus forskohlii,Forskolin,"Weight Management, Cardiovascular Health"
Phytochemicals,Natural Caffeine,Coffea robusta / Camellia sinensis,Caffeine,"Energy, Alertness, Thermogenic"
Phytochemicals,Piperine,Piper nigrum,Piperine,"Bioavailability Enhancer, Thermogenic"
Phytochemicals,Quercetin Dihydrate,Sophora japonica,Quercetin,"Antioxidant, Allergy Relief"
Phytochemicals,Resveratrol,Vitis vinifera,Resveratrol,"Anti-aging, Cardiovascular Support"
Phytochemicals,Rutin,Sophora japonica (est.),Rutin,"Capillary Strength, Antioxidant"
Phytochemicals,Thiocolchicoside,Gloriosa superba,Thiocolchicoside,Muscle Relaxant
Phytochemicals,Vinpocetine,Voacanga africana,Vinpocetine,"Cognitive Support, Neuroprotection"
Phytochemicals,Yohimbine HCL,Pausinystalia yohimbe,Yohimbine,"Libido Support, Fat Loss Aid"
Amino Acids,Acetyl L-Carnitine HCL,Synthetic,Acetyl L-Carnitine,"Cognitive Support, Fat Metabolism"
Amino Acids,Acetyl L-Tyrosine,Synthetic,Acetyl L-Tyrosine,"Mental Focus, Stress Adaptation"
Amino Acids,BCAA Blend / Instant,Fermentation,"Leucine, Isoleucine, Valine","Muscle Recovery, Endurance"
Amino Acids,Beta Alanine,Synthetic,Beta Alanine,"Muscle Carnosine Booster, Performance"
